21:28:57.167785 IP 192.168.198.108.57877 > 180.149.153.11.http: Flags [F.], seq 1371665358, ack 3990729951, win 8192, length 0
21:28:57.443333 IP 192.168.198.108.57871 > 104.236.177.232.8388: Flags [F.], seq 1577183084, ack 3154804055, win 4096, options [nop,nop,TS val 209223665 ecr 2728526617], length 0
21:28:57.851750 IP 192.168.198.108.60540 > public1.114dns.com.domain: 3378+ PTR? 108.198.168.192.in-addr.arpa. (46)
21:28:57.852564 IP 104.236.177.232.8388 > 192.168.198.108.57871: Flags [F.], seq 1, ack 1, win 22, options [nop,nop,TS val 2728541570 ecr 209223665], length 0
21:28:57.852629 IP 192.168.198.108.57871 > 104.236.177.232.8388: Flags [.], ack 2, win 4096, options [nop,nop,TS val 209224074 ecr 2728541570], length 0
21:28:57.866244 IP public1.114dns.com.domain > 192.168.198.108.60540: 3378 NXDomain* 0/1/0 (81)
21:28:57.874728 IP 192.168.198.108.57660 > public1.114dns.com.domain: 3283+ PTR? 11.153.149.180.in-addr.arpa. (45)
21:28:57.887744 IP public1.114dns.com.domain > 192.168.198.108.57660: 3283 NXDomain 0/1/0 (120)
21:28:57.889392 IP 192.168.198.108.63250 > public1.114dns.com.domain: 26217+ PTR? 232.177.236.104.in-addr.arpa. (46)
21:28:57.901910 IP public1.114dns.com.domain > 192.168.198.108.63250: 26217 NXDomain 0/1/0 (113)
21:28:58.569541 IP 192.168.198.108.57802 > pages.github.com.http: Flags [R.], seq 2505069172, ack 4050238814, win 4096, length 0
21:28:58.904881 IP 192.168.198.108.54808 > public1.114dns.com.domain: 9389+ PTR? 114.114.114.114.in-addr.arpa. (46)
21:28:58.921692 IP public1.114dns.com.domain > 192.168.198.108.54808: 9389 1/0/0 PTR public1.114dns.com. (78)
21:28:58.922690 IP 192.168.198.108.64011 > public1.114dns.com.domain: 55261+ PTR? 153.252.30.192.in-addr.arpa. (45)
21:28:59.681240 IP public1.114dns.com.domain > 192.168.198.108.64011: 55261 1/0/0 PTR pages.github.com. (75)
21:28:59.681711 IP 104.236.177.232.8388 > 192.168.198.108.57823: Flags [F.], seq 2481733888, ack 27280465, win 23, options [nop,nop,TS val 2728541946 ecr 208925205], length 0
21:28:59.681769 IP 192.168.198.108.57823 > 104.236.177.232.8388: Flags [.], ack 1, win 4124, options [nop,nop,TS val 209225898 ecr 2728541946], length 0
21:28:59.681840 IP 192.168.198.108.57823 > 104.236.177.232.8388: Flags [F.], seq 1, ack 1, win 4124, options [nop,nop,TS val 209225898 ecr 2728541946], length 0
21:28:59.682603 IP 192.168.198.108.57881 > 104.236.177.232.8388: Flags [S], seq 1546281433, win 65535, options [mss 1460,nop,wscale 5,nop,nop,TS val 209225898 ecr 0,sackOK,eol], length 0
21:28:59.775523 IP 104.236.177.232.8388 > 192.168.198.108.57823: Flags [F.], seq 0, ack 1, win 23, options [nop,nop,TS val 2728542088 ecr 208925205], length 0
21:28:59.775574 IP 192.168.198.108.57823 > 104.236.177.232.8388: Flags [F.], seq 1, ack 1, win 4124, options [nop,nop,TS val 209225991 ecr 2728541946], length 0
21:28:59.890411 IP 104.236.177.232.8388 > 192.168.198.108.57823: Flags [.], ack 2, win 23, options [nop,nop,TS val 2728542116 ecr 209225898], length 0
21:28:59.893668 IP 104.236.177.232.8388 > 192.168.198.108.57881: Flags [S.], seq 4026758734, ack 1546281434, win 43440, options [mss 1452,sackOK,TS val 2728542117 ecr 209225898,nop,wscale 11], length 0
21:28:59.893856 IP 192.168.198.108.57881 > 104.236.177.232.8388: Flags [.], ack 1, win 4140, options [nop,nop,TS val 209226108 ecr 2728542117], length 0
21:28:59.894685 IP 192.168.198.108.57881 > 104.236.177.232.8388: Flags [P.], seq 1:37, ack 1, win 4140, options [nop,nop,TS val 209226108 ecr 2728542117], length 36
21:28:59.894948 IP 192.168.198.108.57881 > 104.236.177.232.8388: Flags [P.], seq 37:554, ack 1, win 4140, options [nop,nop,TS val 209226109 ecr 2728542117], length 517
21:29:00.100327 IP 104.236.177.232.8388 > 192.168.198.108.57881: Flags [.], ack 37, win 22, options [nop,nop,TS val 2728542169 ecr 209226108], length 0
21:29:00.101158 IP 104.236.177.232.8388 > 192.168.198.108.57881: Flags [.], ack 554, win 22, options [nop,nop,TS val 2728542169 ecr 209226109], length 0
21:29:00.155035 IP 104.236.177.232.8388 > 192.168.198.108.57881: Flags [P.], seq 1:202, ack 554, win 22, options [nop,nop,TS val 2728542183 ecr 209226109], length 201
21:29:00.155103 IP 192.168.198.108.57881 > 104.236.177.232.8388: Flags [.], ack 202, win 4133, options [nop,nop,TS val 209226368 ecr 2728542183], length 0
21:29:00.157769 IP 192.168.198.108.57881 > 104.236.177.232.8388: Flags [P.], seq 554:835, ack 202, win 4133, options [nop,nop,TS val 209226370 ecr 2728542183], length 281
21:29:00.158278 IP 192.168.198.108.57881 > 104.236.177.232.8388: Flags [P.], seq 835:1018, ack 202, win 4133, options [nop,nop,TS val 209226370 ecr 2728542183], length 183
21:29:00.352231 IP 192.168.198.108.57883 > 104.236.177.232.8388: Flags [S], seq 2095991755, win 65535, options [mss 1460,nop,wscale 5,nop,nop,TS val 209226563 ecr 0,sackOK,eol], length 0
21:29:00.367209 IP 104.236.177.232.8388 > 192.168.198.108.57881: Flags [.], ack 835, win 23, options [nop,nop,TS val 2728542234 ecr 209226370], length 0
21:29:00.367211 IP 104.236.177.232.8388 > 192.168.198.108.57881: Flags [.], ack 1018, win 23, options [nop,nop,TS val 2728542234 ecr 209226370], length 0
21:29:00.386811 IP 104.236.177.232.8388 > 192.168.198.108.57881: Flags [P.], seq 202:232, ack 1018, win 23, options [nop,nop,TS val 2728542241 ecr 209226370], length 30
21:29:00.387011 IP 192.168.198.108.57881 > 104.236.177.232.8388: Flags [.], ack 232, win 4132, options [nop,nop,TS val 209226597 ecr 2728542241], length 0
21:29:00.396664 IP 192.168.198.108.57858 > 144.191.151.61.dial.xw.sh.dynamic.163data.com.cn.http: Flags [F.], seq 930349845, ack 2225203007, win 8192, length 0
21:29:00.400427 IP 104.236.177.232.8388 > 192.168.198.108.57881: Flags [P.], seq 232:350, ack 1018, win 23, options [nop,nop,TS val 2728542244 ecr 209226370], length 118
21:29:00.400429 IP 104.236.177.232.8388 > 192.168.198.108.57881: Flags [P.], seq 350:511, ack 1018, win 23, options [nop,nop,TS val 2728542245 ecr 209226370], length 161
21:29:00.400487 IP 192.168.198.108.57881 > 104.236.177.232.8388: Flags [.], ack 350, win 4129, options [nop,nop,TS val 209226609 ecr 2728542244], length 0
21:29:00.400487 IP 192.168.198.108.57881 > 104.236.177.232.8388: Flags [.], ack 511, win 4124, options [nop,nop,TS val 209226609 ecr 2728542245], length 0
21:29:00.683189 IP 192.168.198.108.60709 > public1.114dns.com.domain: 19830+ PTR? 144.191.151.61.in-addr.arpa. (45)
21:29:00.702877 IP public1.114dns.com.domain > 192.168.198.108.60709: 19830 1/0/0 PTR 144.191.151.61.dial.xw.sh.dynamic.163data.com.cn. (107)
21:29:00.710617 IP 192.168.198.108.57877 > 180.149.153.11.http: Flags [F.], seq 0, ack 1, win 8192, length 0
21:29:00.767455 IP 192.168.198.108.57885 > 104.236.177.232.8388: Flags [S], seq 3617509174, win 65535, options [mss 1460,nop,wscale 5,nop,nop,TS val 209226974 ecr 0,sackOK,eol], length 0
21:29:00.997592 IP 192.168.198.108.57887 > 104.236.177.232.8388: Flags [S], seq 984583685, win 65535, options [mss 1460,nop,wscale 5,nop,nop,TS val 209227204 ecr 0,sackOK,eol], length 0
21:29:01.064610 IP 192.168.198.108.57889 > 104.236.177.232.8388: Flags [S], seq 998752672, win 65535, options [mss 1460,nop,wscale 5,nop,nop,TS val 209227270 ecr 0,sackOK,eol], length 0
21:29:01.064873 IP 104.236.177.232.8388 > 192.168.198.108.57885: Flags [S.], seq 3553986504, ack 3617509175, win 43440, options [mss 1452,sackOK,TS val 2728542411 ecr 209226974,nop,wscale 11], length 0
21:29:01.064922 IP 192.168.198.108.57885 > 104.236.177.232.8388: Flags [.], ack 1, win 4140, options [nop,nop,TS val 209227270 ecr 2728542411], length 0
21:29:01.065296 IP 192.168.198.108.57885 > 104.236.177.232.8388: Flags [P.], seq 1:35, ack 1, win 4140, options [nop,nop,TS val 209227270 ecr 2728542411], length 34
21:29:01.065535 IP 192.168.198.108.57891 > 104.236.177.232.8388: Flags [S], seq 2858472406, win 65535, options [mss 1460,nop,wscale 5,nop,nop,TS val 209227271 ecr 0,sackOK,eol], length 0
21:29:01.065686 IP 192.168.198.108.57893 > 104.236.177.232.8388: Flags [S], seq 1329781999, win 65535, options [mss 1460,nop,wscale 5,nop,nop,TS val 209227271 ecr 0,sackOK,eol], length 0
21:29:01.072729 IP 192.168.198.108.57885 > 104.236.177.232.8388: Flags [P.], seq 35:246, ack 1, win 4140, options [nop,nop,TS val 209227278 ecr 2728542411], length 211
21:29:01.200612 IP 104.236.177.232.8388 > 192.168.198.108.57887: Flags [S.], seq 1004549275, ack 984583686, win 43440, options [mss 1452,sackOK,TS val 2728542444 ecr 209227204,nop,wscale 11], length 0
21:29:01.200696 IP 192.168.198.108.57887 > 104.236.177.232.8388: Flags [.], ack 1, win 4140, options [nop,nop,TS val 209227405 ecr 2728542444], length 0
21:29:01.201018 IP 192.168.198.108.57887 > 104.236.177.232.8388: Flags [P.], seq 1:35, ack 1, win 4140, options [nop,nop,TS val 209227405 ecr 2728542444], length 34
21:29:01.201294 IP 192.168.198.108.57887 > 104.236.177.232.8388: Flags [P.], seq 35:246, ack 1, win 4140, options [nop,nop,TS val 209227405 ecr 2728542444], length 211
21:29:01.249555 IP 104.236.177.232.8388 > 192.168.198.108.57889: Flags [S.], seq 3837364660, ack 998752673, win 43440, options [mss 1452,sackOK,TS val 2728542456 ecr 209227270,nop,wscale 11], length 0
21:29:01.249623 IP 192.168.198.108.57889 > 104.236.177.232.8388: Flags [.], ack 1, win 4140, options [nop,nop,TS val 209227453 ecr 2728542456], length 0
21:29:01.249917 IP 192.168.198.108.57889 > 104.236.177.232.8388: Flags [P.], seq 1:35, ack 1, win 4140, options [nop,nop,TS val 209227453 ecr 2728542456], length 34
21:29:01.250144 IP 192.168.198.108.57889 > 104.236.177.232.8388: Flags [P.], seq 35:246, ack 1, win 4140, options [nop,nop,TS val 209227453 ecr 2728542456], length 211
21:29:01.268387 IP 104.236.177.232.8388 > 192.168.198.108.57893: Flags [S.], seq 2693747650, ack 1329782000, win 43440, options [mss 1452,sackOK,TS val 2728542461 ecr 209227271,nop,wscale 11], length 0
21:29:01.268441 IP 192.168.198.108.57893 > 104.236.177.232.8388: Flags [.], ack 1, win 4140, options [nop,nop,TS val 209227471 ecr 2728542461], length 0
21:29:01.268747 IP 192.168.198.108.57893 > 104.236.177.232.8388: Flags [P.], seq 1:35, ack 1, win 4140, options [nop,nop,TS val 209227471 ecr 2728542461], length 34
21:29:01.269028 IP 192.168.198.108.57893 > 104.236.177.232.8388: Flags [P.], seq 35:246, ack 1, win 4140, options [nop,nop,TS val 209227471 ecr 2728542461], length 211
21:29:01.366317 IP 104.236.177.232.8388 > 192.168.198.108.57885: Flags [.], ack 35, win 22, options [nop,nop,TS val 2728542485 ecr 209227270], length 0
21:29:01.372871 IP 104.236.177.232.8388 > 192.168.198.108.57885: Flags [.], ack 246, win 22, options [nop,nop,TS val 2728542487 ecr 209227278], length 0
21:29:01.376591 IP 192.168.198.108.57879 > 180.149.153.11.http: Flags [F.], seq 4126516539, ack 948099146, win 8192, length 0
21:29:01.379460 IP 104.236.177.232.8388 > 192.168.198.108.57885: Flags [.], seq 1:1441, ack 246, win 22, options [nop,nop,TS val 2728542488 ecr 209227278], length 1440
21:29:01.379738 IP 104.236.177.232.8388 > 192.168.198.108.57885: Flags [.], seq 1441:2881, ack 246, win 22, options [nop,nop,TS val 2728542488 ecr 209227278], length 1440
21:29:01.379740 IP 104.236.177.232.8388 > 192.168.198.108.57885: Flags [P.], seq 2881:3523, ack 246, win 22, options [nop,nop,TS val 2728542488 ecr 209227278], length 642
21:29:01.379782 IP 192.168.198.108.57885 > 104.236.177.232.8388: Flags [.], ack 2881, win 4051, options [nop,nop,TS val 209227579 ecr 2728542488], length 0
21:29:01.379782 IP 192.168.198.108.57885 > 104.236.177.232.8388: Flags [.], ack 3523, win 4075, options [nop,nop,TS val 209227579 ecr 2728542488], length 0
21:29:01.382965 IP 192.168.198.108.57885 > 104.236.177.232.8388: Flags [P.], seq 246:537, ack 3523, win 4096, options [nop,nop,TS val 209227582 ecr 2728542488], length 291
21:29:01.383872 IP 192.168.198.108.57885 > 104.236.177.232.8388: Flags [P.], seq 537:590, ack 3523, win 4096, options [nop,nop,TS val 209227583 ecr 2728542488], length 53
21:29:01.383953 IP 192.168.198.108.57885 > 104.236.177.232.8388: Flags [P.], seq 590:640, ack 3523, win 4096, options [nop,nop,TS val 209227583 ecr 2728542488], length 50
21:29:01.384032 IP 192.168.198.108.57885 > 104.236.177.232.8388: Flags [P.], seq 640:682, ack 3523, win 4096, options [nop,nop,TS val 209227583 ecr 2728542488], length 42
21:29:01.385217 IP 192.168.198.108.57885 > 104.236.177.232.8388: Flags [P.], seq 682:1772, ack 3523, win 4096, options [nop,nop,TS val 209227584 ecr 2728542488], length 1090
21:29:01.385480 IP 192.168.198.108.57885 > 104.236.177.232.8388: Flags [P.], seq 1772:1866, ack 3523, win 4096, options [nop,nop,TS val 209227584 ecr 2728542488], length 94
21:29:01.385488 IP 192.168.198.108.57885 > 104.236.177.232.8388: Flags [P.], seq 1866:2017, ack 3523, win 4096, options [nop,nop,TS val 209227584 ecr 2728542488], length 151
21:29:01.385616 IP 192.168.198.108.57885 > 104.236.177.232.8388: Flags [P.], seq 2017:2157, ack 3523, win 4096, options [nop,nop,TS val 209227584 ecr 2728542488], length 140
21:29:01.385708 IP 192.168.198.108.57885 > 104.236.177.232.8388: Flags [P.], seq 2157:2292, ack 3523, win 4096, options [nop,nop,TS val 209227584 ecr 2728542488], length 135
21:29:01.385789 IP 192.168.198.108.57885 > 104.236.177.232.8388: Flags [P.], seq 2292:2429, ack 3523, win 4096, options [nop,nop,TS val 209227584 ecr 2728542488], length 137
21:29:01.385905 IP 192.168.198.108.57885 > 104.236.177.232.8388: Flags [P.], seq 2429:2587, ack 3523, win 4096, options [nop,nop,TS val 209227584 ecr 2728542488], length 158
21:29:01.386038 IP 192.168.198.108.57885 > 104.236.177.232.8388: Flags [P.], seq 2587:3120, ack 3523, win 4096, options [nop,nop,TS val 209227584 ecr 2728542488], length 533
21:29:01.394242 IP 192.168.198.108.57885 > 104.236.177.232.8388: Flags [P.], seq 3120:3621, ack 3523, win 4096, options [nop,nop,TS val 209227593 ecr 2728542488], length 501
21:29:01.400484 IP 104.236.177.232.8388 > 192.168.198.108.57887: Flags [.], ack 35, win 22, options [nop,nop,TS val 2728542494 ecr 209227405], length 0
21:29:01.400515 IP 104.236.177.232.8388 > 192.168.198.108.57887: Flags [.], ack 246, win 22, options [nop,nop,TS val 2728542494 ecr 209227405], length 0
21:29:01.407952 IP 104.236.177.232.8388 > 192.168.198.108.57887: Flags [.], seq 1:1441, ack 246, win 22, options [nop,nop,TS val 2728542496 ecr 209227405], length 1440
21:29:01.408192 IP 104.236.177.232.8388 > 192.168.198.108.57887: Flags [P.], seq 2881:3523, ack 246, win 22, options [nop,nop,TS val 2728542496 ecr 209227405], length 642
21:29:01.408234 IP 192.168.198.108.57887 > 104.236.177.232.8388: Flags [.], ack 1441, win 4096, options [nop,nop,TS val 209227606 ecr 2728542496,nop,nop,sack 1 {2881:3523}], length 0
21:29:01.408983 IP 180.149.153.11.http > 192.168.198.108.57879: Flags [R], seq 948099146, win 0, length 0
21:29:01.431876 IP 104.236.177.232.8388 > 192.168.198.108.57889: Flags [.], ack 35, win 22, options [nop,nop,TS val 2728542502 ecr 209227453], length 0
21:29:01.431879 IP 104.236.177.232.8388 > 192.168.198.108.57889: Flags [.], ack 246, win 22, options [nop,nop,TS val 2728542502 ecr 209227453], length 0
21:29:01.440542 IP 104.236.177.232.8388 > 192.168.198.108.57889: Flags [.], seq 1:1441, ack 246, win 22, options [nop,nop,TS val 2728542504 ecr 209227453], length 1440
21:29:01.440727 IP 104.236.177.232.8388 > 192.168.198.108.57889: Flags [.], seq 1441:2881, ack 246, win 22, options [nop,nop,TS val 2728542504 ecr 209227453], length 1440
21:29:01.440767 IP 192.168.198.108.57889 > 104.236.177.232.8388: Flags [.], ack 2881, win 4051, options [nop,nop,TS val 209227637 ecr 2728542504], length 0
21:29:01.441088 IP 104.236.177.232.8388 > 192.168.198.108.57889: Flags [P.], seq 2881:3523, ack 246, win 22, options [nop,nop,TS val 2728542504 ecr 209227453], length 642
21:29:01.441130 IP 192.168.198.108.57889 > 104.236.177.232.8388: Flags [.], ack 3523, win 4075, options [nop,nop,TS val 209227637 ecr 2728542504], length 0
21:29:01.444815 IP 192.168.198.108.57889 > 104.236.177.232.8388: Flags [P.], seq 246:537, ack 3523, win 4096, options [nop,nop,TS val 209227641 ecr 2728542504], length 291
21:29:01.459565 IP 192.168.198.108.57895 > 104.236.177.232.8388: Flags [S], seq 3631263802, win 65535, options [mss 1460,nop,wscale 5,nop,nop,TS val 209227655 ecr 0,sackOK,eol], length 0
21:29:01.471709 IP 104.236.177.232.8388 > 192.168.198.108.57893: Flags [.], ack 35, win 22, options [nop,nop,TS val 2728542511 ecr 209227471], length 0
21:29:01.472319 IP 104.236.177.232.8388 > 192.168.198.108.57893: Flags [.], ack 246, win 22, options [nop,nop,TS val 2728542511 ecr 209227471], length 0
21:29:01.478579 IP 104.236.177.232.8388 > 192.168.198.108.57893: Flags [.], seq 1:1441, ack 246, win 22, options [nop,nop,TS val 2728542513 ecr 209227471], length 1440
21:29:01.478914 IP 104.236.177.232.8388 > 192.168.198.108.57893: Flags [.], seq 1441:2881, ack 246, win 22, options [nop,nop,TS val 2728542513 ecr 209227471], length 1440
21:29:01.479077 IP 192.168.198.108.57893 > 104.236.177.232.8388: Flags [.], ack 2881, win 4051, options [nop,nop,TS val 209227673 ecr 2728542513], length 0
21:29:01.658669 IP 104.236.177.232.8388 > 192.168.198.108.57887: Flags [.], seq 1441:2881, ack 246, win 22, options [nop,nop,TS val 2728542558 ecr 209227606], length 1440
21:29:01.658789 IP 192.168.198.108.57887 > 104.236.177.232.8388: Flags [.], ack 3523, win 4030, options [nop,nop,TS val 209227852 ecr 2728542558], length 0
21:29:01.662926 IP 192.168.198.108.57887 > 104.236.177.232.8388: Flags [P.], seq 246:537, ack 3523, win 4096, options [nop,nop,TS val 209227856 ecr 2728542558], length 291
21:29:01.681095 IP 104.236.177.232.8388 > 192.168.198.108.57885: Flags [.], ack 1772, win 24, options [nop,nop,TS val 2728542564 ecr 209227582], length 0
21:29:01.682533 IP 104.236.177.232.8388 > 192.168.198.108.57885: Flags [.], ack 2292, win 27, options [nop,nop,TS val 2728542565 ecr 209227584], length 0
21:29:01.682537 IP 104.236.177.232.8388 > 192.168.198.108.57885: Flags [.], ack 3120, win 30, options [nop,nop,TS val 2728542565 ecr 209227584], length 0
21:29:01.683725 IP 104.236.177.232.8388 > 192.168.198.108.57885: Flags [P.], seq 3523:3899, ack 3120, win 30, options [nop,nop,TS val 2728542565 ecr 209227584], length 376
21:29:01.683792 IP 192.168.198.108.57885 > 104.236.177.232.8388: Flags [.], ack 3899, win 4084, options [nop,nop,TS val 209227875 ecr 2728542565], length 0
21:29:01.684177 IP 192.168.198.108.57885 > 104.236.177.232.8388: Flags [P.], seq 3621:3659, ack 3899, win 4096, options [nop,nop,TS val 209227875 ecr 2728542565], length 38
21:29:01.688171 IP 104.236.177.232.8388 > 192.168.198.108.57885: Flags [P.], seq 3899:3937, ack 3120, win 30, options [nop,nop,TS val 2728542565 ecr 209227584], length 38
21:29:01.688237 IP 192.168.198.108.57885 > 104.236.177.232.8388: Flags [.], ack 3937, win 4094, options [nop,nop,TS val 209227879 ecr 2728542565], length 0
21:29:01.711840 IP 104.236.177.232.8388 > 192.168.198.108.57885: Flags [P.], seq 3937:4325, ack 3621, win 31, options [nop,nop,TS val 2728542572 ecr 209227593], length 388
21:29:01.711914 IP 192.168.198.108.57885 > 104.236.177.232.8388: Flags [.], ack 4325, win 4083, options [nop,nop,TS val 209227901 ecr 2728542572], length 0
21:29:01.712488 IP 192.168.198.108.57885 > 104.236.177.232.8388: Flags [P.], seq 3659:3705, ack 4325, win 4096, options [nop,nop,TS val 209227901 ecr 2728542572], length 46
21:29:01.716006 IP 104.236.177.232.8388 > 192.168.198.108.57885: Flags [P.], seq 4325:4858, ack 3621, win 31, options [nop,nop,TS val 2728542573 ecr 209227593], length 533
21:29:01.716071 IP 192.168.198.108.57885 > 104.236.177.232.8388: Flags [.], ack 4858, win 4079, options [nop,nop,TS val 209227905 ecr 2728542573], length 0
21:29:01.716697 IP 192.168.198.108.57885 > 104.236.177.232.8388: Flags [P.], seq 3705:3751, ack 4858, win 4096, options [nop,nop,TS val 209227905 ecr 2728542573], length 46
21:29:01.717586 IP 104.236.177.232.8388 > 192.168.198.108.57885: Flags [P.], seq 4858:4989, ack 3621, win 31, options [nop,nop,TS val 2728542573 ecr 209227593], length 131
21:29:01.717650 IP 192.168.198.108.57885 > 104.236.177.232.8388: Flags [.], ack 4989, win 4091, options [nop,nop,TS val 209227906 ecr 2728542573], length 0
21:29:01.718235 IP 192.168.198.108.57885 > 104.236.177.232.8388: Flags [P.], seq 3751:3797, ack 4989, win 4096, options [nop,nop,TS val 209227906 ecr 2728542573], length 46
21:29:01.722628 IP 104.236.177.232.8388 > 192.168.198.108.57885: Flags [P.], seq 4989:5120, ack 3621, win 31, options [nop,nop,TS val 2728542575 ecr 209227593], length 131
21:29:01.722694 IP 192.168.198.108.57885 > 104.236.177.232.8388: Flags [.], ack 5120, win 4091, options [nop,nop,TS val 209227910 ecr 2728542575], length 0
21:29:01.724739 IP 192.168.198.108.57885 > 104.236.177.232.8388: Flags [P.], seq 3797:3843, ack 5120, win 4096, options [nop,nop,TS val 209227912 ecr 2728542575], length 46
21:29:01.728298 IP 104.236.177.232.8388 > 192.168.198.108.57885: Flags [.], seq 5120:6560, ack 3621, win 31, options [nop,nop,TS val 2728542576 ecr 209227593], length 1440
21:29:01.728301 IP 104.236.177.232.8388 > 192.168.198.108.57885: Flags [P.], seq 6560:6737, ack 3621, win 31, options [nop,nop,TS val 2728542576 ecr 209227593], length 177
21:29:01.728369 IP 192.168.198.108.57885 > 104.236.177.232.8388: Flags [.], ack 6737, win 4045, options [nop,nop,TS val 209227915 ecr 2728542576], length 0
21:29:01.728787 IP 192.168.198.108.57885 > 104.236.177.232.8388: Flags [P.], seq 3843:3889, ack 6737, win 4096, options [nop,nop,TS val 209227915 ecr 2728542576], length 46
21:29:01.749257 IP 104.236.177.232.8388 > 192.168.198.108.57885: Flags [.], seq 6737:8177, ack 3621, win 31, options [nop,nop,TS val 2728542580 ecr 209227593], length 1440
21:29:01.749454 IP 104.236.177.232.8388 > 192.168.198.108.57885: Flags [.], seq 8177:9617, ack 3621, win 31, options [nop,nop,TS val 2728542580 ecr 209227593], length 1440
21:29:01.749499 IP 192.168.198.108.57885 > 104.236.177.232.8388: Flags [.], ack 9617, win 4051, options [nop,nop,TS val 209227935 ecr 2728542580], length 0
21:29:01.791005 IP 104.236.177.232.8388 > 192.168.198.108.57883: Flags [S.], seq 2856373981, ack 2095991756, win 43440, options [mss 1452,sackOK,TS val 2728542592 ecr 209226563,nop,wscale 11], length 0
21:29:01.791105 IP 192.168.198.108.57883 > 104.236.177.232.8388: Flags [.], ack 1, win 4140, options [nop,nop,TS val 209227975 ecr 2728542592], length 0
21:29:01.791650 IP 192.168.198.108.57883 > 104.236.177.232.8388: Flags [P.], seq 1:35, ack 1, win 4140, options [nop,nop,TS val 209227975 ecr 2728542592], length 34
21:29:01.791955 IP 192.168.198.108.57883 > 104.236.177.232.8388: Flags [P.], seq 35:552, ack 1, win 4140, options [nop,nop,TS val 209227975 ecr 2728542592], length 517
21:29:01.864121 IP 104.236.177.232.8388 > 192.168.198.108.57887: Flags [P.], seq 3523:3899, ack 537, win 23, options [nop,nop,TS val 2728542610 ecr 209227856], length 376
21:29:01.864219 IP 192.168.198.108.57887 > 104.236.177.232.8388: Flags [.], ack 3899, win 4084, options [nop,nop,TS val 209228048 ecr 2728542610], length 0
21:29:01.895811 IP 192.168.198.108.57872 > github.com.https: Flags [FP.], seq 744794383:744794452, ack 1528154817, win 4096, options [nop,nop,TS val 209228079 ecr 2077251914], length 69
21:29:01.985523 IP 104.236.177.232.8388 > 192.168.198.108.57885: Flags [.], seq 9617:11057, ack 3659, win 31, options [nop,nop,TS val 2728542640 ecr 209227875], length 1440
21:29:01.985782 IP 104.236.177.232.8388 > 192.168.198.108.57885: Flags [.], seq 11057:12497, ack 3659, win 31, options [nop,nop,TS val 2728542640 ecr 209227875], length 1440
21:29:01.985804 IP 192.168.198.108.57885 > 104.236.177.232.8388: Flags [.], ack 11057, win 4096, options [nop,nop,TS val 209228168 ecr 2728542640], length 0
21:29:02.019547 IP 104.236.177.232.8388 > 192.168.198.108.57885: Flags [.], seq 12497:13937, ack 3705, win 31, options [nop,nop,TS val 2728542646 ecr 209227901], length 1440
21:29:02.019553 IP 104.236.177.232.8388 > 192.168.198.108.57885: Flags [.], seq 13937:15377, ack 3705, win 31, options [nop,nop,TS val 2728542646 ecr 209227901], length 1440
21:29:02.019554 IP 104.236.177.232.8388 > 192.168.198.108.57885: Flags [.], ack 3797, win 31, options [nop,nop,TS val 2728542647 ecr 209227905], length 0
21:29:02.019632 IP 192.168.198.108.57885 > 104.236.177.232.8388: Flags [.], ack 13937, win 4051, options [nop,nop,TS val 209228201 ecr 2728542640], length 0
21:29:02.019814 IP 192.168.198.108.57885 > 104.236.177.232.8388: Flags [.], ack 15377, win 4096, options [nop,nop,TS val 209228201 ecr 2728542646], length 0
21:29:02.020691 IP 104.236.177.232.8388 > 192.168.198.108.57885: Flags [.], seq 15377:16817, ack 3797, win 31, options [nop,nop,TS val 2728542648 ecr 209227910], length 1440
21:29:02.021435 IP 104.236.177.232.8388 > 192.168.198.108.57885: Flags [.], seq 16817:18257, ack 3797, win 31, options [nop,nop,TS val 2728542648 ecr 209227910], length 1440
21:29:02.021482 IP 192.168.198.108.57885 > 104.236.177.232.8388: Flags [.], ack 18257, win 4051, options [nop,nop,TS val 209228202 ecr 2728542648], length 0
21:29:02.024762 IP 104.236.177.232.8388 > 192.168.198.108.57885: Flags [.], seq 18257:19697, ack 3843, win 31, options [nop,nop,TS val 2728542650 ecr 209227912], length 1440
21:29:02.024874 IP 192.168.198.108.57885 > 104.236.177.232.8388: Flags [.], ack 19697, win 4096, options [nop,nop,TS val 209228206 ecr 2728542650], length 0
21:29:02.024942 IP 104.236.177.232.8388 > 192.168.198.108.57885: Flags [.], seq 19697:21137, ack 3843, win 31, options [nop,nop,TS val 2728542650 ecr 209227912], length 1440
21:29:02.051879 IP 104.236.177.232.8388 > 192.168.198.108.57885: Flags [.], seq 21137:22577, ack 3889, win 31, options [nop,nop,TS val 2728542656 ecr 209227915], length 1440
21:29:02.051883 IP 104.236.177.232.8388 > 192.168.198.108.57885: Flags [.], seq 22577:24017, ack 3889, win 31, options [nop,nop,TS val 2728542656 ecr 209227915], length 1440
21:29:02.051958 IP 192.168.198.108.57885 > 104.236.177.232.8388: Flags [.], ack 22577, win 4051, options [nop,nop,TS val 209228233 ecr 2728542650], length 0
21:29:02.052079 IP 192.168.198.108.57885 > 104.236.177.232.8388: Flags [.], ack 24017, win 4096, options [nop,nop,TS val 209228233 ecr 2728542656], length 0
21:29:02.072536 IP 104.236.177.232.8388 > 192.168.198.108.57883: Flags [.], ack 35, win 22, options [nop,nop,TS val 2728542662 ecr 209227975], length 0
21:29:02.072539 IP 104.236.177.232.8388 > 192.168.198.108.57883: Flags [.], ack 552, win 22, options [nop,nop,TS val 2728542662 ecr 209227975], length 0
21:29:02.078336 IP 104.236.177.232.8388 > 192.168.198.108.57883: Flags [P.], seq 1:167, ack 552, win 22, options [nop,nop,TS val 2728542664 ecr 209227975], length 166
21:29:02.078440 IP 192.168.198.108.57883 > 104.236.177.232.8388: Flags [.], ack 167, win 4134, options [nop,nop,TS val 209228258 ecr 2728542664], length 0
21:29:02.080324 IP 192.168.198.108.57883 > 104.236.177.232.8388: Flags [P.], seq 552:768, ack 167, win 4134, options [nop,nop,TS val 209228259 ecr 2728542664], length 216
21:29:02.108454 IP 104.236.177.232.8388 > 192.168.198.108.57889: Flags [P.], seq 3523:3899, ack 537, win 23, options [nop,nop,TS val 2728542671 ecr 209227641], length 376
21:29:02.108585 IP 192.168.198.108.57889 > 104.236.177.232.8388: Flags [.], ack 3899, win 4084, options [nop,nop,TS val 209228286 ecr 2728542671], length 0
21:29:02.186203 IP 104.236.177.232.8388 > 192.168.198.108.57893: Flags [P.], seq 2881:3523, ack 246, win 22, options [nop,nop,TS val 2728542691 ecr 209227673], length 642
21:29:02.186318 IP 192.168.198.108.57893 > 104.236.177.232.8388: Flags [.], ack 3523, win 4075, options [nop,nop,TS val 209228363 ecr 2728542691], length 0
21:29:02.190232 IP 192.168.198.108.57893 > 104.236.177.232.8388: Flags [P.], seq 246:537, ack 3523, win 4096, options [nop,nop,TS val 209228366 ecr 2728542691], length 291
21:29:02.320919 IP 104.236.177.232.8388 > 192.168.198.108.57885: Flags [.], seq 25457:26897, ack 3889, win 31, options [nop,nop,TS val 2728542723 ecr 209228201], length 1440
21:29:02.321024 IP 192.168.198.108.57885 > 104.236.177.232.8388: Flags [.], ack 24017, win 4096, options [nop,nop,TS val 209228496 ecr 2728542656,nop,nop,sack 1 {25457:26897}], length 0
21:29:02.322055 IP 104.236.177.232.8388 > 192.168.198.108.57885: Flags [.], seq 26897:28337, ack 3889, win 31, options [nop,nop,TS val 2728542723 ecr 209228201], length 1440
21:29:02.322116 IP 192.168.198.108.57885 > 104.236.177.232.8388: Flags [.], ack 24017, win 4096, options [nop,nop,TS val 209228497 ecr 2728542656,nop,nop,sack 1 {25457:28337}], length 0
21:29:02.322805 IP 104.236.177.232.8388 > 192.168.198.108.57885: Flags [.], seq 28337:29777, ack 3889, win 31, options [nop,nop,TS val 2728542723 ecr 209228201], length 1440
21:29:02.322861 IP 192.168.198.108.57885 > 104.236.177.232.8388: Flags [.], ack 24017, win 4096, options [nop,nop,TS val 209228497 ecr 2728542656,nop,nop,sack 1 {25457:29777}], length 0
21:29:02.325728 IP 104.236.177.232.8388 > 192.168.198.108.57885: Flags [.], seq 29777:31217, ack 3889, win 31, options [nop,nop,TS val 2728542724 ecr 209228202], length 1440
21:29:02.325790 IP 192.168.198.108.57885 > 104.236.177.232.8388: Flags [.], ack 24017, win 4096, options [nop,nop,TS val 209228500 ecr 2728542656,nop,nop,sack 1 {25457:31217}], length 0
21:29:02.325878 IP 104.236.177.232.8388 > 192.168.198.108.57885: Flags [.], seq 31217:32657, ack 3889, win 31, options [nop,nop,TS val 2728542724 ecr 209228202], length 1440
21:29:02.325898 IP 192.168.198.108.57885 > 104.236.177.232.8388: Flags [.], ack 24017, win 4096, options [nop,nop,TS val 209228500 ecr 2728542656,nop,nop,sack 1 {25457:32657}], length 0
21:29:02.331163 IP 104.236.177.232.8388 > 192.168.198.108.57885: Flags [.], seq 32657:34097, ack 3889, win 31, options [nop,nop,TS val 2728542725 ecr 209228206], length 1440
21:29:02.331171 IP 104.236.177.232.8388 > 192.168.198.108.57885: Flags [.], seq 34097:35537, ack 3889, win 31, options [nop,nop,TS val 2728542725 ecr 209228206], length 1440
21:29:02.331278 IP 192.168.198.108.57885 > 104.236.177.232.8388: Flags [.], ack 24017, win 4096, options [nop,nop,TS val 209228505 ecr 2728542656,nop,nop,sack 1 {25457:34097}], length 0
21:29:02.331278 IP 192.168.198.108.57885 > 104.236.177.232.8388: Flags [.], ack 24017, win 4096, options [nop,nop,TS val 209228505 ecr 2728542656,nop,nop,sack 1 {25457:35537}], length 0
21:29:02.349249 IP 104.236.177.232.8388 > 192.168.198.108.57885: Flags [.], seq 35537:36977, ack 3889, win 31, options [nop,nop,TS val 2728542731 ecr 209228233], length 1440
21:29:02.349256 IP 104.236.177.232.8388 > 192.168.198.108.57885: Flags [.], seq 36977:38417, ack 3889, win 31, options [nop,nop,TS val 2728542731 ecr 209228233], length 1440
21:29:02.349427 IP 192.168.198.108.57885 > 104.236.177.232.8388: Flags [.], ack 24017, win 4096, options [nop,nop,TS val 209228523 ecr 2728542656,nop,nop,sack 1 {25457:36977}], length 0
21:29:02.349428 IP 192.168.198.108.57885 > 104.236.177.232.8388: Flags [.], ack 24017, win 4096, options [nop,nop,TS val 209228523 ecr 2728542656,nop,nop,sack 1 {25457:38417}], length 0
21:29:02.379269 IP 104.236.177.232.8388 > 192.168.198.108.57883: Flags [P.], seq 167:265, ack 768, win 23, options [nop,nop,TS val 2728542736 ecr 209228259], length 98
21:29:02.379367 IP 192.168.198.108.57883 > 104.236.177.232.8388: Flags [.], ack 265, win 4131, options [nop,nop,TS val 209228552 ecr 2728542736], length 0
21:29:02.707037 IP 192.168.198.108.53028 > public1.114dns.com.domain: 10226+ PTR? 128.252.30.192.in-addr.arpa. (45)
21:29:02.713737 IP 104.236.177.232.8388 > 192.168.198.108.57891: Flags [S.], seq 2580618401, ack 2858472407, win 43440, options [mss 1452,sackOK,TS val 2728542792 ecr 209227271,nop,wscale 11], length 0
21:29:02.713742 IP 104.236.177.232.8388 > 192.168.198.108.57885: Flags [.], seq 38417:39857, ack 3889, win 31, options [nop,nop,TS val 2728542798 ecr 209228497], length 1440
21:29:02.713743 IP 104.236.177.232.8388 > 192.168.198.108.57885: Flags [.], seq 39857:41297, ack 3889, win 31, options [nop,nop,TS val 2728542798 ecr 209228497], length 1440
21:29:02.713745 IP 104.236.177.232.8388 > 192.168.198.108.57885: Flags [.], seq 41297:42737, ack 3889, win 31, options [nop,nop,TS val 2728542798 ecr 209228497], length 1440
21:29:02.713782 IP 104.236.177.232.8388 > 192.168.198.108.57885: Flags [.], seq 24017:25457, ack 3889, win 31, options [nop,nop,TS val 2728542799 ecr 209228497], length 1440
21:29:02.713858 IP 192.168.198.108.57891 > 104.236.177.232.8388: Flags [.], ack 1, win 4140, options [nop,nop,TS val 209228886 ecr 2728542792], length 0
21:29:02.713859 IP 192.168.198.108.57885 > 104.236.177.232.8388: Flags [.], ack 24017, win 4096, options [nop,nop,TS val 209228886 ecr 2728542656,nop,nop,sack 1 {25457:39857}], length 0
21:29:02.713859 IP 192.168.198.108.57885 > 104.236.177.232.8388: Flags [.], ack 24017, win 4096, options [nop,nop,TS val 209228886 ecr 2728542656,nop,nop,sack 1 {25457:41297}], length 0
21:29:02.713860 IP 192.168.198.108.57885 > 104.236.177.232.8388: Flags [.], ack 24017, win 4096, options [nop,nop,TS val 209228886 ecr 2728542656,nop,nop,sack 1 {25457:42737}], length 0
21:29:02.713930 IP 192.168.198.108.57885 > 104.236.177.232.8388: Flags [.], ack 42737, win 3511, options [nop,nop,TS val 209228886 ecr 2728542799], length 0
21:29:02.714055 IP 104.236.177.232.8388 > 192.168.198.108.57885: Flags [.], seq 42737:44177, ack 3889, win 31, options [nop,nop,TS val 2728542800 ecr 209228500], length 1440
21:29:02.714058 IP 104.236.177.232.8388 > 192.168.198.108.57885: Flags [.], seq 44177:45617, ack 3889, win 31, options [nop,nop,TS val 2728542801 ecr 209228505], length 1440
21:29:02.714116 IP 192.168.198.108.57885 > 104.236.177.232.8388: Flags [.], ack 45617, win 3467, options [nop,nop,TS val 209228886 ecr 2728542800], length 0
21:29:02.714368 IP 192.168.198.108.57885 > 104.236.177.232.8388: Flags [.], ack 45617, win 3561, options [nop,nop,TS val 209228886 ecr 2728542800], length 0
21:29:02.714485 IP 192.168.198.108.57885 > 104.236.177.232.8388: Flags [.], ack 45617, win 3655, options [nop,nop,TS val 209228886 ecr 2728542800], length 0
21:29:02.714609 IP 192.168.198.108.57885 > 104.236.177.232.8388: Flags [.], ack 45617, win 3749, options [nop,nop,TS val 209228886 ecr 2728542800], length 0
21:29:02.715009 IP 192.168.198.108.57891 > 104.236.177.232.8388: Flags [P.], seq 1:35, ack 1, win 4140, options [nop,nop,TS val 209228887 ecr 2728542792], length 34
21:29:02.715045 IP 192.168.198.108.57885 > 104.236.177.232.8388: Flags [.], ack 45617, win 3842, options [nop,nop,TS val 209228887 ecr 2728542800], length 0
21:29:02.715216 IP 192.168.198.108.57885 > 104.236.177.232.8388: Flags [.], ack 45617, win 3936, options [nop,nop,TS val 209228887 ecr 2728542800], length 0
21:29:02.715377 IP 192.168.198.108.57885 > 104.236.177.232.8388: Flags [.], ack 45617, win 4030, options [nop,nop,TS val 209228887 ecr 2728542800], length 0
21:29:02.715476 IP 192.168.198.108.57891 > 104.236.177.232.8388: Flags [P.], seq 35:552, ack 1, win 4140, options [nop,nop,TS val 209228887 ecr 2728542792], length 517
21:29:02.717223 IP 192.168.198.108.57885 > 104.236.177.232.8388: Flags [P.], seq 3889:3931, ack 45617, win 4096, options [nop,nop,TS val 209228889 ecr 2728542800], length 42
21:29:02.725752 IP public1.114dns.com.domain > 192.168.198.108.53028: 10226 1/0/0 PTR github.com. (69)
21:29:02.796759 IP 192.168.198.108.57856 > 101.226.103.86.http: Flags [FP.], seq 2851135572:2851136864, ack 228745765, win 4140, options [nop,nop,TS val 209228968 ecr 501610881], length 1292
21:29:02.901618 IP 192.168.198.108.57885 > 104.236.177.232.8388: Flags [P.], seq 3931:4139, ack 45617, win 4096, options [nop,nop,TS val 209229072 ecr 2728542800], length 208
21:29:02.911329 IP 192.168.198.108.57885 > 104.236.177.232.8388: Flags [P.], seq 4139:4300, ack 45617, win 4096, options [nop,nop,TS val 209229081 ecr 2728542800], length 161
21:29:02.961542 IP 104.236.177.232.8388 > 192.168.198.108.57891: Flags [.], ack 35, win 22, options [nop,nop,TS val 2728542885 ecr 209228887], length 0
21:29:02.962102 IP 104.236.177.232.8388 > 192.168.198.108.57891: Flags [.], ack 552, win 22, options [nop,nop,TS val 2728542885 ecr 209228887], length 0
21:29:02.967348 IP 104.236.177.232.8388 > 192.168.198.108.57891: Flags [P.], seq 1:167, ack 552, win 22, options [nop,nop,TS val 2728542886 ecr 209228887], length 166
21:29:02.967400 IP 192.168.198.108.57891 > 104.236.177.232.8388: Flags [.], ack 167, win 4134, options [nop,nop,TS val 209229136 ecr 2728542886], length 0
21:29:02.968820 IP 192.168.198.108.57891 > 104.236.177.232.8388: Flags [P.], seq 552:768, ack 167, win 4134, options [nop,nop,TS val 209229137 ecr 2728542886], length 216
21:29:02.990672 IP 104.236.177.232.8388 > 192.168.198.108.57895: Flags [S.], seq 3019800483, ack 3631263803, win 43440, options [mss 1452,sackOK,TS val 2728542892 ecr 209227655,nop,wscale 11], length 0
21:29:02.990754 IP 192.168.198.108.57895 > 104.236.177.232.8388: Flags [.], ack 1, win 4140, options [nop,nop,TS val 209229158 ecr 2728542892], length 0
21:29:02.991372 IP 192.168.198.108.57895 > 104.236.177.232.8388: Flags [P.], seq 1:35, ack 1, win 4140, options [nop,nop,TS val 209229158 ecr 2728542892], length 34
21:29:02.992496 IP 192.168.198.108.57895 > 104.236.177.232.8388: Flags [P.], seq 35:202, ack 1, win 4140, options [nop,nop,TS val 209229159 ecr 2728542892], length 167
21:29:03.001625 IP 104.236.177.232.8388 > 192.168.198.108.57885: Flags [.], seq 47057:48497, ack 3889, win 31, options [nop,nop,TS val 2728542895 ecr 209228886], length 1440
21:29:03.001680 IP 192.168.198.108.57885 > 104.236.177.232.8388: Flags [.], ack 45617, win 4096, options [nop,nop,TS val 209229168 ecr 2728542800,nop,nop,sack 1 {47057:48497}], length 0
21:29:03.001849 IP 104.236.177.232.8388 > 192.168.198.108.57885: Flags [.], seq 48497:49937, ack 3889, win 31, options [nop,nop,TS val 2728542895 ecr 209228886], length 1440
21:29:03.001851 IP 104.236.177.232.8388 > 192.168.198.108.57885: Flags [.], seq 49937:51377, ack 3889, win 31, options [nop,nop,TS val 2728542895 ecr 209228886], length 1440
21:29:03.001886 IP 192.168.198.108.57885 > 104.236.177.232.8388: Flags [.], ack 45617, win 4096, options [nop,nop,TS val 209229168 ecr 2728542800,nop,nop,sack 1 {47057:49937}], length 0
21:29:03.001887 IP 192.168.198.108.57885 > 104.236.177.232.8388: Flags [.], ack 45617, win 4096, options [nop,nop,TS val 209229168 ecr 2728542800,nop,nop,sack 1 {47057:51377}], length 0
21:29:03.004495 IP 104.236.177.232.8388 > 192.168.198.108.57885: Flags [.], seq 51377:52817, ack 3889, win 31, options [nop,nop,TS val 2728542895 ecr 209228886], length 1440
21:29:03.004546 IP 192.168.198.108.57885 > 104.236.177.232.8388: Flags [.], ack 45617, win 4096, options [nop,nop,TS val 209229171 ecr 2728542800,nop,nop,sack 1 {47057:52817}], length 0
21:29:03.042488 IP 104.236.177.232.8388 > 192.168.198.108.57885: Flags [.], ack 3931, win 31, options [nop,nop,TS val 2728542905 ecr 209228889], length 0
21:29:03.087359 IP 192.168.198.108.57885 > 104.236.177.232.8388: Flags [P.], seq 4300:4342, ack 45617, win 4096, options [nop,nop,TS val 209229253 ecr 2728542800,nop,nop,sack 1 {47057:52817}], length 42
21:29:03.088779 IP 192.168.198.108.57885 > 104.236.177.232.8388: Flags [P.], seq 4342:4504, ack 45617, win 4096, options [nop,nop,TS val 209229254 ecr 2728542800,nop,nop,sack 1 {47057:52817}], length 162
21:29:03.111148 IP 192.168.198.108.43321 > public1.114dns.com.domain: 11954+ A? sjtubus.sinaapp.com. (37)
21:29:03.111683 IP 192.168.198.108.55673 > public1.114dns.com.domain: 43521+ A? api.map.baidu.com. (35)
21:29:03.112321 IP 192.168.198.108.10333 > public1.114dns.com.domain: 50559+ A? api0.map.bdimg.com. (36)
21:29:03.112684 IP 192.168.198.108.8938 > public1.114dns.com.domain: 17379+ A? hm.baidu.com. (30)
21:29:03.112857 IP 192.168.198.108.18361 > public1.114dns.com.domain: 59027+ A? log.hm.baidu.com. (34)
21:29:03.114681 IP 192.168.198.108.14478 > public1.114dns.com.domain: 14128+ A? online0.map.bdimg.com. (39)
